{"$schema":"https://json-schema.org/draft/2020-12/schema","$id":"CTR-TEN-001","title":"Trusted Tenant Context","type":"object","additionalProperties":false,"required":["workspace_id","actor","request_id","correlation_id","locale","timezone"],"properties":{"workspace_id":{"type":"string","minLength":1},"business_profile_id":{"type":"string","minLength":1},"page_context_profile_id":{"type":"string","minLength":1},"actor":{"type":"object","additionalProperties":false,"required":["kind","id"],"properties":{"kind":{"enum":["user","system_actor"]},"id":{"type":"string","minLength":1}}},"request_id":{"type":"string","minLength":1},"correlation_id":{"type":"string","minLength":1},"causation_id":{"type":"string","minLength":1},"locale":{"const":"th-TH"},"timezone":{"const":"Asia/Bangkok"}}}
